Отметка времени,Короткий заголовок,Описание идеи (в любом формате),Ваши контакты,Как это поможет нашему движению?
25.01.2024 22:13:57,Venona project,"Counterintelligence program initiated during World War II by the United States Army's Signal Intelligence Service and later absorbed by the, that ran from February 1, 1943, until October 1, 1980.[1] It was intended to decrypt messages transmitted by the intelligence agencies of the Soviet Union ().[2] Initiated when the Soviet Union was an ally of the, the program continued during the Cold War, when the Soviet Union was considered an enemy.",https://en.wikipedia.org/wiki/Venona_project,
25.01.2024 22:14:12,Fairview project,"Fairview is a secret program under which the  cooperates with the American telecommunications company AT&T in order to collect phone, internet and e-mail data mainly of foreign countries' citizens at major cable landing stations and switching stations inside the . The FAIRVIEW program started in 1985, one year after the Bell breakup.[1]",https://en.wikipedia.org/wiki/Fairview_(surveillance_program),
25.01.2024 22:14:28,PRISM,"PRISM is a code name for a program under which the  collects internet communications from various U.S. internet companies.[1][2][3] The program is also known by the SIGAD US-984XN.[4][5] PRISM collects stored internet communications based on demands made to internet companies such as Google LLC and Apple under Section 702 of the FISA Amendments Act of 2008 to turn over any data that match court-approved search terms.[6] Among other things, the can use these PRISM requests to target communications that were encrypted when they traveled across the internet backbone, to focus on stored data that telecommunication filtering systems discarded earlier,[7][8] and to get data that is easier to handle.[9]",https://en.wikipedia.org/wiki/PRISM,
25.01.2024 22:14:51,Ultra cryptography,Ultra was the designation adopted by British intelligence in June 1941 for wartime signals intelligence obtained by breaking high-level encrypted enemy radio and teleprinter communications at the Government Code and Cypher School (GC&CS) at Bletchley Park.[1] Ultra eventually became the standard designation among the western Allies for all such intelligence. The name arose because the intelligence obtained was considered more important than that designated by the highest British security classification then used (Most Secret) and so was regarded as being Ultra Secret.[2] Several other cryptonyms had been used for such intelligence.,https://en.wikipedia.org/wiki/Ultra_(cryptography),
25.01.2024 22:15:04,Star Wars program,"The concept was announced on March 23, 1983, by President Ronald Reagan,[1] a vocal critic of the doctrine of mutually assured destruction (MAD), which he described as a ""suicide pact"". Reagan called upon American scientists and engineers to develop a system that would render nuclear weapons obsolete.[2] Elements of the program reemerged in 2019 with the Space Development Agency (SDA).[3]",https://en.wikipedia.org/wiki/Strategic_Defense_Initiative,
